{
  "id": "schema:open_to_introductions",
  "version": 1,
  "name": "open_to_introductions",
  "statement_kind": "self_declaration",
  "semantics": {
    "establishes": "An attributed statement only.",
    "does_not_establish": [
      "Contact details may be disclosed",
      "Consent inferred from relationship status"
    ]
  },
  "fields": [
    {
      "name": "enabled",
      "type": "boolean",
      "equality": "exact",
      "required": true,
      "disclosure_class": "sensitive"
    },
    {
      "name": "adult_opt_in",
      "type": "boolean",
      "equality": "exact",
      "required": true,
      "disclosure_class": "sensitive"
    }
  ],
  "cardinality": {
    "mode": "single",
    "slot_fields": []
  },
  "incompatibilities": [],
  "freshness_default": {
    "kind": "none"
  },
  "disclosure_defaults": [
    {
      "field_class": "public",
      "audiences": [
        "aud:public",
        "aud:private"
      ],
      "purposes": [
        "purpose:read",
        "purpose:publish"
      ]
    },
    {
      "field_class": "restricted",
      "audiences": [
        "aud:private"
      ],
      "purposes": [
        "purpose:read",
        "purpose:publish"
      ]
    },
    {
      "field_class": "sensitive",
      "audiences": [
        "aud:private"
      ],
      "purposes": [
        "purpose:read",
        "purpose:publish"
      ]
    }
  ],
  "requirements": [
    "synthetic_only",
    "no_derived_consent",
    "adult_opt_in",
    "mutual_contact_consent"
  ]
}
