{
  "id": "schema:availability",
  "version": 1,
  "name": "availability",
  "statement_kind": "self_declaration",
  "semantics": {
    "establishes": "An attributed statement only.",
    "does_not_establish": []
  },
  "fields": [
    {
      "name": "value",
      "type": "string",
      "equality": "exact",
      "required": true,
      "disclosure_class": "restricted"
    }
  ],
  "cardinality": {
    "mode": "single",
    "slot_fields": []
  },
  "incompatibilities": [
    {
      "id": "incompat:availability:value",
      "field": "value",
      "relation": "unequal",
      "statement_kinds": [
        "self_declaration"
      ],
      "same": [
        "subject",
        "space",
        "perspective",
        "slot"
      ],
      "overlap": "required"
    }
  ],
  "freshness_default": {
    "kind": "duration",
    "seconds": 86400
  },
  "disclosure_defaults": [
    {
      "field_class": "public",
      "audiences": [
        "aud:public",
        "aud:private"
      ],
      "purposes": [
        "purpose:read",
        "purpose:publish"
      ]
    },
    {
      "field_class": "restricted",
      "audiences": [
        "aud:private"
      ],
      "purposes": [
        "purpose:read",
        "purpose:publish"
      ]
    },
    {
      "field_class": "sensitive",
      "audiences": [
        "aud:private"
      ],
      "purposes": [
        "purpose:read",
        "purpose:publish"
      ]
    }
  ],
  "requirements": [
    "synthetic_only"
  ]
}
