{
  "id": "schema:account_link",
  "version": 1,
  "name": "account_link",
  "statement_kind": "self_declaration",
  "semantics": {
    "establishes": "An attributed statement only.",
    "does_not_establish": [
      "Proven account control without an exact account_control assessment"
    ]
  },
  "fields": [
    {
      "name": "account",
      "type": "string",
      "equality": "exact",
      "required": true,
      "disclosure_class": "restricted"
    }
  ],
  "cardinality": {
    "mode": "multi",
    "slot_fields": []
  },
  "incompatibilities": [],
  "freshness_default": {
    "kind": "none"
  },
  "disclosure_defaults": [
    {
      "field_class": "public",
      "audiences": [
        "aud:public",
        "aud:private"
      ],
      "purposes": [
        "purpose:read",
        "purpose:publish"
      ]
    },
    {
      "field_class": "restricted",
      "audiences": [
        "aud:private"
      ],
      "purposes": [
        "purpose:read",
        "purpose:publish"
      ]
    },
    {
      "field_class": "sensitive",
      "audiences": [
        "aud:private"
      ],
      "purposes": [
        "purpose:read",
        "purpose:publish"
      ]
    }
  ],
  "requirements": [
    "synthetic_only",
    "account_control_for_established"
  ]
}
